{
  "gate_id": "SUG-UPDATE-VALID-001",
  "update_class": "registry_layer_count_change",
  "previous_snapshot_id": "SRS-BASELINE-001",
  "proposed_snapshot_id": "SRS-BASELINE-002",
  "previous_sealed_head": "#56 QA-PILOT-STARTUP-SURFACE-REGRESSION-SNAPSHOT-1",
  "proposed_sealed_head": "#57 QA-PILOT-HYPOTHETICAL-SPRINT-1",
  "previous_layer_count": 23,
  "proposed_layer_count": 24,
  "previous_rcr_count": 8,
  "proposed_rcr_count": 9,
  "previous_rcg_gap": 0,
  "proposed_rcg_gap": 0,
  "rationale": "Hypothetical sprint #57 added a new pipeline layer. Layer count increases from 23 to 24. RCR receipt count increases to 9. No RCG coverage gap change. Snapshot update is legitimate.",
  "advisory_only": true,
  "custody": "qa-pilot-local",
  "librarian_impact": "none",
  "not_seal_authority": "This snapshot update gate does not confer sealing authority.",
  "not_librarian_mutation_authority": "This gate does not authorize Librarian file mutation.",
  "created_at": "2026-07-07T21:10:00Z"
}
