{
  "gate_id": "SUG-NO-UPDATE-001",
  "update_class": "no_snapshot_update_required",
  "previous_snapshot_id": "SRS-BASELINE-001",
  "proposed_snapshot_id": "SRS-BASELINE-001",
  "previous_sealed_head": "#56 QA-PILOT-STARTUP-SURFACE-REGRESSION-SNAPSHOT-1",
  "proposed_sealed_head": "#56 QA-PILOT-STARTUP-SURFACE-REGRESSION-SNAPSHOT-1",
  "previous_layer_count": 23,
  "proposed_layer_count": 23,
  "previous_rcr_count": 8,
  "proposed_rcr_count": 8,
  "previous_rcg_gap": 0,
  "proposed_rcg_gap": 0,
  "rationale": "Baseline still matches live state. No surface changes since snapshot was sealed. No update required.",
  "advisory_only": true,
  "custody": "qa-pilot-local",
  "librarian_impact": "none",
  "not_seal_authority": "No sealing authority claimed.",
  "not_librarian_mutation_authority": "No Librarian mutation claimed.",
  "created_at": "2026-07-07T21:11:00Z"
}
